AT849/21 ,n.a. ,"Jiangsu Bioperfectus Technologies Co., Ltd. ",Novel Coronavirus (SARS-CoV-2) Ag Rapid Test Kit ,N ,"100,0% ","75,0% ","0,0% ","70,0% ",
AT857/21 ,n.a. ,"Shen Zhen Zi Jian Biotechnology Co., Ltd. ",Zijian SARS-CoV-2 (COVID-19) Antigen Rapid Detection Kit (Lateral Flow Method) ,N ,"80,0% ","10,0% ","0,0% ","36,0% ",
AT863/21 ,n.a. ,"Pro-med (Beijing) Technology Co.,Ltd. ",Pro-med COVID-19 Antigen Rapid Detection Kit ,N ,"80,0% ","5,0% ","0,0% ","34,0% ",
AT879/21 ,209.01.25.01 ,"Biohit Healthcare (Hefei) Co., Ltd. ",SARS-CoV-2 Antigen Rapid Test (Colloidal Gold Method) ,N ,"100,0% ","95,0% ","20,0% ","82,0% ",
AT882/21 ,n.a. ,"Jiaxing Wisetest Bio-Tech Co., Ltd. ",Saliva SARS-CoV-2 (2019-nCoV) Antigen Test Kit (Nanocarbon Assay) ,N ,"85,0% ","15,0% ","10,0% ","42,0% ",
AT883/21 ,CO-05 ,"Jiangsu Well Biotech Co., Ltd. ",COVID-19 Schnelltestgerät ,N ,"100,0% ","95,0% ","40,0% ","86,0% ",
AT889/21 ,n.a. ,CITEST Diagnostics Inc. ,COVID-19 Antigen Rapid Test (Oral Fluid) ,N ,"100,0% ","100,0% ","90,0% ","98,0% ",
AT918/21 ,SCVC02 ,SGA Mühendislik DAN. EG. Icve DIS.Ltd.STI ,V-Chek SARS-CoV-2 Rapid Ag Test Kit (Colloidal Gold) ,N ,"94,1% ","26,1% ","0,0% ","44,0% ",
AT924/21 ,C2104N01 ,Cesna Biyoteknoloji Arastirma Gelistirme Laboratuvar Sist. ,Check Up SARS-CoV-2 Nasal Antigen Rapid Test ,N ,"100,0% ","45,0% ","10,0% ","60,0% ",
AT928/21 ,CG201A ,"Shenzhen CAS-Envision Medical Technology Co., Ltd. ",SARS-Cov-2 Antigen Rapid Detection Kit ,N ,"100,0% ","100,0% ","70,0% ","94,0% ",
AT934/21 ,G-C-0104 ,"Hangzhou Zheda Dixun Biological Gene Engineering Co., Ltd. ",Bisdeal SARS-CoV-2 Antigen-Schnelltest ,N ,"100,0% ","25,0% ","0,0% ","50,0% ",
AT935/21 ,n.a. ,"Qingdao AIBO Diagnostic CO., Ltd. ",Novel Coronavirus (COVID-19) Antigen Rapid Test Kit ,N ,"100,0% ","20,0% ","0,0% ","48,0% ",
AT941/21 ,"T3701W, T3702W, T3706W ","Sichuan Xincheng Biological Co., Ltd. ",SARS-CoV-2 Antigen Assay Kit by Latex Immunochromatography method ,N ,"100,0% ","95,0% ","40,0% ","86,0% ",
AT961/21 ,n.a. ,"Hangzhou Jucheng Medical Products Co., Ltd ",SARS-CoV-2 Ag Schnelltestkit ,N ,"100,0% ","100,0% ","80,0% ","96,0% ",
AT967/21 ,P2311 ,"Beijing Homa Biological Engineering Co., Ltd. ",COVID-19 Antigen Test Kit ,N ,"100,0% ","35,0% ","0,0% ","54,0% ",
AT981/21 (AT574/21) ,ITP16010-TC25 ,"InTec Products, Inc. ",Rapid SARS-CoV-2 Antigen Test Colloidal Gold (Nasopharyngeal/Nasal specimen) ,N ,"100,0% ","95,0% ","30,0% ","84,0% ",
AT989/21 ,NBMLRS-XG-S2 ,Ningbo Beautiful Life Medical Biotechnology ,Saliva SARS-CoV-2(2019-nCoV) Antigen Test Kit (Nanocarbon Assay) ,N ,"100,0% ","35,0% ","0,0% ","54,0% ",
AT997/21 ,FP-318 ,"Wuhan HealthCare Biotechnology Co., Ltd. ",SARS-CoV-2 Antigen Test Kit (Colloidal Gold) ,N ,"90,0% ","0,0% ","0,0% ","36,0% ",
